book_title,author,img,price,ratings,no_of_purchase,url,genre
python programming crash course,"English, Paperback, Charles Tony F",https://rukminim1.flixcart.com/image/612/612/l3dcl8w0/book/d/j/n/python-programming-crash-course-original-imageg7srnjxrhyk.jpeg?q=70,"₹1,572",,,https://www.flipkart.com/search?q=python+programming+books&otracker=search&otracker1=search&marketplace=FLIPKART&as-show=on&as=off&page=10,python programming
Guide to Beginners in Python Programming,"Paperback, Sheriff Babu",https://rukminim1.flixcart.com/image/612/612/xif0q/book/w/a/c/guide-to-beginners-in-python-programming-original-imagpevbyzmbwxvr.jpeg?q=70,₹375,,,https://www.flipkart.com/search?q=python+programming+books&otracker=search&otracker1=search&marketplace=FLIPKART&as-show=on&as=off&page=10,python programming
"Automate The Boring Stuff With Python, 2nd Edition","English, Paperback, Sweigart Al",https://rukminim1.flixcart.com/image/612/612/l5jxt3k0/book/1/s/4/automate-the-boring-stuff-with-python-2nd-edition-original-imagg7zah86phk9z.jpeg?q=70,"₹2,429",4.7,(23),https://www.flipkart.com/search?q=python+programming+books&otracker=search&otracker1=search&marketplace=FLIPKART&as-show=on&as=off&page=10,python programming
"Zero To Mastery In Python Programming, Best Python Book For Beginners, This Python Book Covers A-Z About Programming In Python, Also Comes With Python Tricks You Should Definietly Know, Latest Edition  - Zero To Mastery In Python Programming, Best Python Book For Beginners, This Python Book Covers A-Z About Programming In Python, Also Comes With Python Tricks You Should Definietly Know, Latest Edition (Paperback, RAKESH K. YADAV, SRINIVAS ARUKONDA, MONU SINGH) with 1 Disc","Paperback, RAKESH K. YADAV, SRINIVAS ARUKONDA, MONU SINGH",https://rukminim1.flixcart.com/image/612/612/kq8dua80/book/v/f/2/zero-to-mastery-in-python-programming-best-python-book-for-original-imag4ab2gzadhskq.jpeg?q=70,₹325,4.2,(280),https://www.flipkart.com/search?q=python+programming+books&otracker=search&otracker1=search&marketplace=FLIPKART&as-show=on&as=off&page=10,python programming
Using Asyncio in Python: Understanding Python's Asynchronous Programming Features,"English, Paperback, Caleb Hattingh",https://rukminim1.flixcart.com/image/612/612/k73nlow0/book/6/7/5/using-asyncio-in-python-understanding-python-s-asynchronous-original-imafpehgmftsqyqd.jpeg?q=70,₹650,,,https://www.flipkart.com/search?q=python+programming+books&otracker=search&otracker1=search&marketplace=FLIPKART&as-show=on&as=off&page=10,python programming
"Test-Driven Development with Python: Obey the Testing Goat - Using Django, Selenium, and JavaScript, 2nd Edition","English, Paperback, Harry J.W. Percival",https://rukminim1.flixcart.com/image/612/612/j7ksia80/book/1/6/2/test-driven-development-with-python-obey-the-testing-goat-using-original-imaexpehghdjzuha.jpeg?q=70,"₹1,725",,,https://www.flipkart.com/search?q=python+programming+books&otracker=search&otracker1=search&marketplace=FLIPKART&as-show=on&as=off&page=10,python programming
"Natural Language Processing with Python (English, Paperback, Loper Edward)","English, Paperback, Loper Edward",https://rukminim1.flixcart.com/image/612/612/k6v2ykw0/book/4/8/6/natural-language-processing-with-python-original-imafp873rzyv74hg.jpeg?q=70,"₹1,750",4.3,(38),https://www.flipkart.com/search?q=python+programming+books&otracker=search&otracker1=search&marketplace=FLIPKART&as-show=on&as=off&page=10,python programming
CBSE Python Coding Practice Workbook for AI Artificial Intelligence CS Computer Science IP ICT (Session 2021-22),"English, Paperback, Av Editorial Board",https://rukminim1.flixcart.com/image/612/612/kpvivm80/book/g/d/b/cbse-python-coding-practice-workbook-for-ai-artificial-original-imag4ydsx6zb8gvg.jpeg?q=70,₹795,,,https://www.flipkart.com/search?q=python+programming+books&otracker=search&otracker1=search&marketplace=FLIPKART&as-show=on&as=off&page=10,python programming
High Performance Python:,"English, Paperback, Gorelick",https://rukminim1.flixcart.com/image/612/612/kjd6nww0-0/book/m/r/x/high-performance-python-original-imafyxqkmx4kxr64.jpeg?q=70,₹810,2.5,(4),https://www.flipkart.com/search?q=python+programming+books&otracker=search&otracker1=search&marketplace=FLIPKART&as-show=on&as=off&page=10,python programming
"Flask Web Development: Developing Web Applications with Python, 2nd Edition (English, Paperback, Miguel Grinberg)","English, Paperback, Miguel Grinberg",https://rukminim1.flixcart.com/image/612/612/k7dnonk0/book/9/9/5/flask-web-development-developing-web-applications-with-python-original-imafpmqhr8hszynw.jpeg?q=70,"₹1,100",4.8,(13),https://www.flipkart.com/search?q=python+programming+books&otracker=search&otracker1=search&marketplace=FLIPKART&as-show=on&as=off&page=10,python programming
The Hitchhiker's Guide to Python  - Best Practices for Development,"English, Paperback, Kenneth Reitz Tanya Schlusser",https://rukminim1.flixcart.com/image/612/612/kjd6nww0-0/book/x/j/7/the-hitchhiker-s-guide-to-python-original-imafyxhfnk4ze6ze.jpeg?q=70,"₹1,100",4.2,(6),https://www.flipkart.com/search?q=python+programming+books&otracker=search&otracker1=search&marketplace=FLIPKART&as-show=on&as=off&page=10,python programming
Data Wrangling with Python  - Tips and Tools to Make Your Life Easier,"English, Paperback, Katharine Jarmul Jacqueline Kazil",https://rukminim1.flixcart.com/image/612/612/kjd6nww0-0/book/8/c/p/data-wrangling-with-python-original-imafyxmybgmjvbmz.jpeg?q=70,"₹1,300",,,https://www.flipkart.com/search?q=python+programming+books&otracker=search&otracker1=search&marketplace=FLIPKART&as-show=on&as=off&page=10,python programming
Thoughtful Machine Learning with Python: A Test-Driven Approach,"English, Paperback, Matthew Kirk",https://rukminim1.flixcart.com/image/612/612/j2xlzm80/book/1/2/7/thoughtful-machine-learning-with-python-a-test-driven-approach-original-imaeu4zf9hagypry.jpeg?q=70,₹650,,,https://www.flipkart.com/search?q=python+programming+books&otracker=search&otracker1=search&marketplace=FLIPKART&as-show=on&as=off&page=10,python programming
Python and HDF5 1st  Edition,"English, Paperback, Andrew Collette",https://rukminim1.flixcart.com/image/612/612/book/8/5/1/python-and-hdf5-original-imaefwgtzphnjy5d.jpeg?q=70,₹550,5,(3),https://www.flipkart.com/search?q=python+programming+books&otracker=search&otracker1=search&marketplace=FLIPKART&as-show=on&as=off&page=10,python programming
Think DSP: Digital Signal Processing in Python  - Digital Signal Processing in Python,"English, Paperback, Downey Allen B.",https://rukminim1.flixcart.com/image/612/612/kj8wccw0-0/book/d/f/u/think-dsp-digital-signal-processing-in-python-original-imafyuzgnxgefsgp.jpeg?q=70,₹600,,,https://www.flipkart.com/search?q=python+programming+books&otracker=search&otracker1=search&marketplace=FLIPKART&as-show=on&as=off&page=10,python programming
"Data Visualization With Python & JavaScript  - Scrape, Clean, Explore & Transform Your Data","English, Paperback, Dale Kyran",https://rukminim1.flixcart.com/image/612/612/kjabs7k0-0/book/c/s/f/data-visualization-with-python-javascript-original-imafyw2nushcdzx4.jpeg?q=70,"₹1,475",,,https://www.flipkart.com/search?q=python+programming+books&otracker=search&otracker1=search&marketplace=FLIPKART&as-show=on&as=off&page=10,python programming
"Learning Python (English, Paperback, Lutz Mark)","English, Paperback, Lutz Mark",https://rukminim1.flixcart.com/image/612/612/k7dnonk0/book/0/1/4/learning-python-original-imafpmqhcyvhnfdb.jpeg?q=70,"₹1,800",4.4,(387),https://www.flipkart.com/search?q=python+programming+books&otracker=search&otracker1=search&marketplace=FLIPKART&as-show=on&as=off&page=10,python programming
Foundations for Analytics with Python  - From Non-Programmer to Hacker,"English, Paperback, Brownley Clinton W.",https://rukminim1.flixcart.com/image/612/612/kjn6qvk0-0/book/h/r/r/foundations-for-analytics-with-python-original-imafz5d7jkfyuyyq.jpeg?q=70,"₹1,050",,,https://www.flipkart.com/search?q=python+programming+books&otracker=search&otracker1=search&marketplace=FLIPKART&as-show=on&as=off&page=10,python programming
Programming With Micropython: Embedded Programming With Microcontrollers And Python  - 0,"English, Paperback, Nicholas H. Tollervey",https://rukminim1.flixcart.com/image/612/612/j9k8ivk0/book/4/0/7/programming-with-micropython-embedded-programming-with-original-imaezaz3fzrrpks3.jpeg?q=70,₹775,,,https://www.flipkart.com/search?q=python+programming+books&otracker=search&otracker1=search&marketplace=FLIPKART&as-show=on&as=off&page=10,python programming
"High Performance Python: Practical Performant Programming for Humans, 2nd Edition (Greyscale Indian Edition) (Paperback, Micha Gorelick, Ian Ozsvald)","Paperback, Micha Gorelick, Ian Ozsvald",https://rukminim1.flixcart.com/image/612/612/kcm9t3k0/book/9/4/1/high-performance-python-practical-performant-programming-for-original-imaftp89ejvzzghq.jpeg?q=70,"₹1,800",,,https://www.flipkart.com/search?q=python+programming+books&otracker=search&otracker1=search&marketplace=FLIPKART&as-show=on&as=off&page=10,python programming
"Fluent Python: Clear, Concise, and Effective Programming, Second Edition (Grayscale Indian Edition)","Paperback, Luciano Ramalho",https://rukminim1.flixcart.com/image/612/612/l30hmkw0/book/8/5/t/fluent-python-clear-concise-and-effective-programming-second-original-image7uzhhjgf6r4.jpeg?q=70,"₹2,600",5,(3),https://www.flipkart.com/search?q=python+programming+books&otracker=search&otracker1=search&marketplace=FLIPKART&as-show=on&as=off&page=10,python programming
Let Us Python,"English, Paperback, Kanetkar Y.",https://rukminim1.flixcart.com/image/612/612/xif0q/book/q/f/n/let-us-python-original-imagjh6u26fjctvq.jpeg?q=70,₹370,4.5,(33),https://www.flipkart.com/search?q=python+programming+books&otracker=search&otracker1=search&marketplace=FLIPKART&as-show=on&as=off&page=10,python programming
"PYTHON CODING  - Become a Coder Fast. Machine Learning, Data Analysis Using Python, Code-Creation Methods, and Beginner's Programming Tips and Tricks (2022 Crash Course for Newbies)","English, Paperback, Pierce Weaver",https://rukminim1.flixcart.com/image/612/612/xif0q/book/e/g/x/python-coding-original-imagjvyycwyg7s7n.jpeg?q=70,₹312,4.7,(3),https://www.flipkart.com/search?q=python+programming+books&otracker=search&otracker1=search&marketplace=FLIPKART&as-show=on&as=off&page=10,python programming
Deep Learning with Python,"English, Paperback, Chollet Francois",https://rukminim1.flixcart.com/image/612/612/kpzt7680/book/o/n/s/deep-learning-with-python-second-edition-original-imag43yypzhtxdtz.jpeg?q=70,"₹4,247",4.6,(56),https://www.flipkart.com/search?q=python+programming+books&otracker=search&otracker1=search&marketplace=FLIPKART&as-show=on&as=off&page=10,python programming
Let Us Python,"English, Paperback, Kanetkar Yashavant",https://rukminim1.flixcart.com/image/612/612/kwzap3k0/book/e/d/g/let-us-python-4th-edition-python-is-future-embrace-it-fast-original-imag9jesmffpxb3j.jpeg?q=70,₹379,4.4,"(1,329)",https://www.flipkart.com/search?q=python+programming+books&otracker=search&otracker1=search&marketplace=FLIPKART&as-show=on&as=off&page=10,python programming
Introduction to Computer Science Using Python  - A Computational Problem - Solving Focus,"English, Paperback, unknown",https://rukminim1.flixcart.com/image/612/612/jpu324w0/book/0/1/4/introduction-to-computer-science-using-python-original-imafbzzbkcwhunz9.jpeg?q=70,₹450,4.4,(87),https://www.flipkart.com/search?q=python+programming+books&otracker=search&otracker1=search&marketplace=FLIPKART&as-show=on&as=off&page=10,python programming
"Python Crash Course, 3rd Edition","English, Paperback, Matthes Eric",https://rukminim1.flixcart.com/image/612/612/xif0q/book/n/c/k/python-crash-course-3rd-edition-original-imagk8yxf7quvgbt.jpeg?q=70,"₹1,299",3.1,(8),https://www.flipkart.com/search?q=python+programming+books&otracker=search&otracker1=search&marketplace=FLIPKART&as-show=on&as=off&page=10,python programming
Data Structure and Algorithmic Thinking with Python,"English, Paperback, Karumanchi Narasimha",https://rukminim1.flixcart.com/image/612/612/k45x0nk0/book/5/9/2/data-structure-and-algorithmic-thinking-with-python-original-imafnfd8dqfshrhy.jpeg?q=70,₹629,4.5,(541),https://www.flipkart.com/search?q=python+programming+books&otracker=search&otracker1=search&marketplace=FLIPKART&as-show=on&as=off&page=10,python programming
Impractical Python Projects,"English, Paperback, Vaughan Lee",https://rukminim1.flixcart.com/image/612/612/l5jxt3k0/book/i/h/x/impractical-python-projects-original-imagg7z7wp7axr7f.jpeg?q=70,"₹1,999",,,https://www.flipkart.com/search?q=python+programming+books&otracker=search&otracker1=search&marketplace=FLIPKART&as-show=on&as=off&page=10,python programming
Python Tricks,"English, Paperback, Bader Dan",https://rukminim1.flixcart.com/image/612/612/xif0q/book/u/l/m/python-tricks-original-imagjz5yftcdp3gs.jpeg?q=70,₹327,4.5,(157),https://www.flipkart.com/search?q=python+programming+books&otracker=search&otracker1=search&marketplace=FLIPKART&as-show=on&as=off&page=10,python programming
Numerical Methods in Engineering with Python 3,"English, Hardcover, Kiusalaas Jaan",https://rukminim1.flixcart.com/image/612/612/jay8xow0/book/8/5/6/numerical-methods-in-engineering-with-python-3-original-imafyeb5qk2hxnwn.jpeg?q=70,"₹8,547",,,https://www.flipkart.com/search?q=python+programming+books&otracker=search&otracker1=search&marketplace=FLIPKART&as-show=on&as=off&page=10,python programming
Python In - Depth,"English, Paperback, Ayeva Kamon",https://rukminim1.flixcart.com/image/612/612/kon887k0/book/3/a/v/python-in-depth-original-imag3fck7ch4cqhb.jpeg?q=70,₹479,,,https://www.flipkart.com/search?q=python+programming+books&otracker=search&otracker1=search&marketplace=FLIPKART&as-show=on&as=off&page=10,python programming
DATA SCIENCE WITH PYTHON  - A Beginner's Guide to Python for Data Science That's Easy to Follow (2022 Crash Course for Newbies),"English, Paperback, Wade Briggs",https://rukminim1.flixcart.com/image/612/612/xif0q/book/2/f/l/data-science-with-python-original-imagjvnwfxppt36b.jpeg?q=70,₹260,,,https://www.flipkart.com/search?q=python+programming+books&otracker=search&otracker1=search&marketplace=FLIPKART&as-show=on&as=off&page=10,python programming
Data Structures and Algorithms in Python,"English, Paperback, Goodrich M. T.",https://rukminim1.flixcart.com/image/612/612/krkyt8w0/book/r/e/j/data-structures-and-algorithms-in-python-an-indian-adaptation-original-imag5c99saagk6ye.jpeg?q=70,₹745,4.9,(29),https://www.flipkart.com/search?q=python+programming+books&otracker=search&otracker1=search&marketplace=FLIPKART&as-show=on&as=off&page=10,python programming
Introduction to Computating & Problem Solving Through Python,"English, Paperback, Jose Jeeva",https://rukminim1.flixcart.com/image/612/612/book/8/1/0/introduction-to-computing-problem-solving-with-python-original-imaezk3gqzjdhfz5.jpeg?q=70,₹234,4.4,(108),https://www.flipkart.com/search?q=python+programming+books&otracker=search&otracker1=search&marketplace=FLIPKART&as-show=on&as=off&page=10,python programming
Django: Web Development with Python,"English, Paperback, Dauzon Samuel",https://rukminim1.flixcart.com/image/612/612/knxiavk0/book/y/q/w/django-web-development-with-python-original-imag2ht9gvx8hpa3.jpeg?q=70,"₹6,599",4.3,(4),https://www.flipkart.com/search?q=python+programming+books&otracker=search&otracker1=search&marketplace=FLIPKART&as-show=on&as=off&page=10,python programming
Handbook of Python,"English, Paperback, S Ramprakash",https://rukminim1.flixcart.com/image/612/612/xif0q/book/p/q/3/handbook-of-python-original-imagkcjjcv54d5ex.jpeg?q=70,₹100,,,https://www.flipkart.com/search?q=python+programming+books&otracker=search&otracker1=search&marketplace=FLIPKART&as-show=on&as=off&page=10,python programming
Learn Web Development with Python,"English, Paperback, Romano Fabrizio",https://rukminim1.flixcart.com/image/612/612/xif0q/book/s/g/x/learn-web-development-with-python-original-imagmfd3t2yrt7dx.jpeg?q=70,"₹2,471",,,https://www.flipkart.com/search?q=python+programming+books&otracker=search&otracker1=search&marketplace=FLIPKART&as-show=on&as=off&page=10,python programming
Clean Code in Python,"English, Paperback, Anaya Mariano",https://rukminim1.flixcart.com/image/612/612/xif0q/book/r/y/u/clean-code-in-python-original-imag44yjkjgwyphf.jpeg?q=70,"₹2,154",,,https://www.flipkart.com/search?q=python+programming+books&otracker=search&otracker1=search&marketplace=FLIPKART&as-show=on&as=off&page=10,python programming
Computer Coding Python Projects for Kids,"English, Paperback, Vorderman Carol",https://rukminim1.flixcart.com/image/612/612/ksqeky80/book/r/0/x/computer-coding-python-projects-for-kids-original-imag68qcdtfsj3g3.jpeg?q=70,₹571,4,(5),https://www.flipkart.com/search?q=python+programming+books&otracker=search&otracker1=search&marketplace=FLIPKART&as-show=on&as=off&page=10,python programming
