book_title,author,img,price,ratings,no_of_purchase,url,genre
A Primer to Python Programming  - Code Yourself,"English, Paperback, Dr Muralidharan Murugesan",https://rukminim1.flixcart.com/image/612/612/xif0q/book/6/x/1/a-primer-to-python-programming-original-imagjw2kyhjrm4p8.jpeg?q=70,₹327,,,https://www.flipkart.com/search?q=python+programming+books&otracker=search&otracker1=search&marketplace=FLIPKART&as-show=on&as=off&page=4,python programming
"{Set of 3 Books} B.Sc. (Computer Science) - Mathematics with Practical Book - SY Semester 3 - As per SPPU's 2020 CBCS Pattern [GROUPS & CODING THEORY (Paper 1) , NUMERICAL TECHNIQUES (Paper 2), PYTHON PROGRAMMING LANGUAGE 1 (PRACTICAL - PAPER 3 MTC 233)]","Paperback, M. D. Bhagat, R. S. Bhamare, N. M. Phatangare, Dr. S. G. Purane, Dr. A. S. Khairnar, Hrishikesh Khaladkar",https://rukminim1.flixcart.com/image/612/612/khtghow0-0/book/h/9/9/set-of-3-books-b-sc-computer-science-mathematics-with-practical-original-imafxr4azztpfh2p.jpeg?q=70,₹280,,,https://www.flipkart.com/search?q=python+programming+books&otracker=search&otracker1=search&marketplace=FLIPKART&as-show=on&as=off&page=4,python programming
Learn Python Programming,"English, Paperback, Romano Fabrizio",https://rukminim1.flixcart.com/image/612/612/xif0q/book/9/2/l/learn-python-programming-original-imagmfcnfpjenhxd.jpeg?q=70,"₹2,082",,,https://www.flipkart.com/search?q=python+programming+books&otracker=search&otracker1=search&marketplace=FLIPKART&as-show=on&as=off&page=4,python programming
"Zero To Mastery In Python Programming, Best Python Book For Beginners, This Python Book Covers A-Z About Programming In Python, Also Comes With Python Tricks You Should Definietly Know, Latest Edition  - Zero To Mastery In Python Programming, Best Python Book For Beginners, This Python Book Covers A-Z About Programming In Python, Also Comes With Python Tricks You Should Definietly Know, Latest Edition (Paperback, RAKESH K. YADAV, SRINIVAS ARUKONDA, MONU SINGH) with 1 Disc","Paperback, RAKESH K. YADAV, SRINIVAS ARUKONDA, MONU SINGH",https://rukminim1.flixcart.com/image/612/612/kq8dua80/book/v/f/2/zero-to-mastery-in-python-programming-best-python-book-for-original-imag4ab2gzadhskq.jpeg?q=70,₹325,4.2,(280),https://www.flipkart.com/search?q=python+programming+books&otracker=search&otracker1=search&marketplace=FLIPKART&as-show=on&as=off&page=4,python programming
Learn Python Programming,"English, Paperback, Romano Fabrizio",https://rukminim1.flixcart.com/image/612/612/xif0q/book/h/h/1/learn-python-programming-original-imagmfdjgngwqhf3.jpeg?q=70,"₹2,154",,,https://www.flipkart.com/search?q=python+programming+books&otracker=search&otracker1=search&marketplace=FLIPKART&as-show=on&as=off&page=4,python programming
Python GUI Programming Cookbook,"English, Paperback, Meier Burkhard A.",https://rukminim1.flixcart.com/image/612/612/book/7/5/8/python-gui-programming-cookbook-original-imaekspfhketgdg3.jpeg?q=70,"₹2,217",,,https://www.flipkart.com/search?q=python+programming+books&otracker=search&otracker1=search&marketplace=FLIPKART&as-show=on&as=off&page=4,python programming
Python GUI Programming Cookbook -,"English, Electronic book text, Meier Burkhard A.",https://rukminim1.flixcart.com/image/612/612/jokcyvk0/book/4/5/0/python-gui-programming-cookbook-original-imafazwcp5ez8xug.jpeg?q=70,"₹4,099",,,https://www.flipkart.com/search?q=python+programming+books&otracker=search&otracker1=search&marketplace=FLIPKART&as-show=on&as=off&page=4,python programming
CBSE Python Coding Practice Workbook for AI Artificial Intelligence CS Computer Science IP ICT (Session 2021-22),"English, Paperback, Av Editorial Board",https://rukminim1.flixcart.com/image/612/612/kpvivm80/book/g/d/b/cbse-python-coding-practice-workbook-for-ai-artificial-original-imag4ydsx6zb8gvg.jpeg?q=70,₹795,,,https://www.flipkart.com/search?q=python+programming+books&otracker=search&otracker1=search&marketplace=FLIPKART&as-show=on&as=off&page=4,python programming
Programming and Problem Solving using Python,"English, Paperback, Puntambekar Anuradha A",https://rukminim1.flixcart.com/image/612/612/xif0q/book/r/b/x/programming-and-problem-solving-using-python-original-imagktbzzdzgyzk8.jpeg?q=70,₹310,,,https://www.flipkart.com/search?q=python+programming+books&otracker=search&otracker1=search&marketplace=FLIPKART&as-show=on&as=off&page=4,python programming
MITx 6.00.1x Introduction to Computer Science and Programming Using Python Assignments Coding Exercises Problem Sets,"English, Paperback, Av Editorial Board",https://rukminim1.flixcart.com/image/612/612/kxaq7ww0/book/l/a/9/mitx-6-00-1x-introduction-to-computer-science-and-programming-original-imag9sjw4hckm8ep.jpeg?q=70,₹296,,,https://www.flipkart.com/search?q=python+programming+books&otracker=search&otracker1=search&marketplace=FLIPKART&as-show=on&as=off&page=4,python programming
Programming for Computations - Python,"English, Hardcover, Linge Svein",https://rukminim1.flixcart.com/image/612/612/k8ddoy80/book/7/6/6/programming-for-computations-python-original-imafqesewn33uunc.jpeg?q=70,"₹4,129",,,https://www.flipkart.com/search?q=python+programming+books&otracker=search&otracker1=search&marketplace=FLIPKART&as-show=on&as=off&page=4,python programming
"Introduction to Programming in Python: An Interdisciplinary Approach, 1e","English, Paperback, Sedgewick",https://rukminim1.flixcart.com/image/612/612/book/4/3/5/introduction-to-programming-in-python-an-interdisciplinary-original-imaehb878t8xdhn4.jpeg?q=70,"₹1,079",4.3,(23),https://www.flipkart.com/search?q=python+programming+books&otracker=search&otracker1=search&marketplace=FLIPKART&as-show=on&as=off&page=4,python programming
Programming with Python,"English, Paperback, Padmanabhan T R",https://rukminim1.flixcart.com/image/612/612/kidgnm80-0/book/4/n/z/programming-with-python-original-imafy6szdaxs8mzw.jpeg?q=70,"₹9,520",,,https://www.flipkart.com/search?q=python+programming+books&otracker=search&otracker1=search&marketplace=FLIPKART&as-show=on&as=off&page=4,python programming
Functional Python Programming,"English, Paperback, Lott Steven F.",https://rukminim1.flixcart.com/image/612/612/xif0q/book/n/k/8/functional-python-programming-third-edition-original-imaghhgwvyvryffs.jpeg?q=70,"₹2,166",,,https://www.flipkart.com/search?q=python+programming+books&otracker=search&otracker1=search&marketplace=FLIPKART&as-show=on&as=off&page=4,python programming
CBSE Computer Science Practical Programming in Python for Class XII Practical And Examination Workbook,"Paperback, Prof. (Dr.) Atanu Das, Prof. Rajkumar Patra",https://rukminim1.flixcart.com/image/612/612/l4x2rgw0/book/5/x/4/cbse-computer-science-practical-programming-in-python-for-class-original-imagfp8cf7adfrrv.jpeg?q=70,₹425,,,https://www.flipkart.com/search?q=python+programming+books&otracker=search&otracker1=search&marketplace=FLIPKART&as-show=on&as=off&page=4,python programming
Basic Core Python Programming,"English, Paperback, Kohli Meenu",https://rukminim1.flixcart.com/image/612/612/kpzt7680/book/g/d/r/basic-core-python-programming-original-imag43zprdycguu4.jpeg?q=70,₹634,4.2,(5),https://www.flipkart.com/search?q=python+programming+books&otracker=search&otracker1=search&marketplace=FLIPKART&as-show=on&as=off&page=4,python programming
Python Programming for Students,"Paperback, Mahesh Bhave , Sunil Patekar",https://rukminim1.flixcart.com/image/612/612/ks243gw0/book/d/j/y/python-programming-for-students-original-imag5p9hrcpgbmxr.jpeg?q=70,₹975,,,https://www.flipkart.com/search?q=python+programming+books&otracker=search&otracker1=search&marketplace=FLIPKART&as-show=on&as=off&page=4,python programming
Programming ArcGIS with Python Cookbook -,"English, Electronic book text, Pimpler Eric",https://rukminim1.flixcart.com/image/612/612/book/8/9/8/programming-arcgis-with-python-cookbook-second-edition-original-imaekspfadqdfrmc.jpeg?q=70,"₹2,217",,,https://www.flipkart.com/search?q=python+programming+books&otracker=search&otracker1=search&marketplace=FLIPKART&as-show=on&as=off&page=4,python programming
Programming for Problem Solving with Python,"Paperback, R.S.Salaria",https://rukminim1.flixcart.com/image/612/612/xif0q/book/x/8/3/programming-for-problem-solving-with-python-original-imaggr4fyf7yhbt4.jpeg?q=70,₹369,5,(3),https://www.flipkart.com/search?q=python+programming+books&otracker=search&otracker1=search&marketplace=FLIPKART&as-show=on&as=off&page=4,python programming
Mastering GUI Programming with Python,"English, Paperback, Moore Alan D.",https://rukminim1.flixcart.com/image/612/612/xif0q/book/r/q/a/mastering-gui-programming-with-python-original-imagh77vnebq4b8s.jpeg?q=70,"₹1,848",,,https://www.flipkart.com/search?q=python+programming+books&otracker=search&otracker1=search&marketplace=FLIPKART&as-show=on&as=off&page=4,python programming
Foundations of Python Network Programming,"English, Paperback, Goerzen John",https://rukminim1.flixcart.com/image/612/612/johi3680/book/0/3/8/foundations-of-python-network-programming-original-imafax6ed5mkdfue.jpeg?q=70,"₹5,192",,,https://www.flipkart.com/search?q=python+programming+books&otracker=search&otracker1=search&marketplace=FLIPKART&as-show=on&as=off&page=4,python programming
Python Object-Oriented Programming,"English, Paperback, F. Lott Steven",https://rukminim1.flixcart.com/image/612/612/xif0q/book/m/m/i/python-object-oriented-programming-original-imagacsxkmyx3vwh.jpeg?q=70,"₹2,799",5,(1),https://www.flipkart.com/search?q=python+programming+books&otracker=search&otracker1=search&marketplace=FLIPKART&as-show=on&as=off&page=4,python programming
Python Programming for GTU 18 Course (V -Electrical/Electronics/ECE/Open Elec.-I - 3151108),"Paperback, A. A. Puntambekar, Hitesh P. Patel",https://rukminim1.flixcart.com/image/612/612/kkyc9zk0/book/y/p/p/python-programming-for-gtu-18-course-v-electrical-electronics-original-imagy6rkrp6zga7z.jpeg?q=70,₹275,4.2,(6),https://www.flipkart.com/search?q=python+programming+books&otracker=search&otracker1=search&marketplace=FLIPKART&as-show=on&as=off&page=4,python programming
Python Programming  - The Fundamentals and Beyond,"English, Paperback, Syed Ayaan Hussain",https://rukminim1.flixcart.com/image/612/612/xif0q/book/x/t/z/python-programming-original-imagzhg25gwcpryh.jpeg?q=70,₹580,,,https://www.flipkart.com/search?q=python+programming+books&otracker=search&otracker1=search&marketplace=FLIPKART&as-show=on&as=off&page=4,python programming
PROGRAMMING IN PYTHON-1 : SEC: MT-3510 (Third Year TYBSc/TYBA Mathematics Semester 5),"Paperback, Dr Kalyanrao Takale, Dr Amjad Shaikh, Prof Krishna Ghode, Dr Shrikishan Gaikwad, Prof SR Patil",https://rukminim1.flixcart.com/image/612/612/ktx9si80/book/g/h/t/programming-in-python-1-sec-mt-3510-third-year-tybsc-tyba-original-imag75xw9jzueyaz.jpeg?q=70,₹180,,,https://www.flipkart.com/search?q=python+programming+books&otracker=search&otracker1=search&marketplace=FLIPKART&as-show=on&as=off&page=4,python programming
An Introduction to Python Programming: A Practical Approach,"English, Paperback, Dr. Brijesh Bakariya Dr. Krishna Kumar Mohbey",https://rukminim1.flixcart.com/image/612/612/kt39jm80/book/3/p/1/an-introduction-to-python-programming-a-practical-approach-original-imag6hsgxqwzdp3j.jpeg?q=70,₹634,,,https://www.flipkart.com/search?q=python+programming+books&otracker=search&otracker1=search&marketplace=FLIPKART&as-show=on&as=off&page=4,python programming
Learn Python Programming,"English, Paperback, Shamsher S Dhillon",https://rukminim1.flixcart.com/image/612/612/kmax8y80/book/5/q/h/learn-python-programming-original-imagf7v4bv4sxqzq.jpeg?q=70,₹416,,,https://www.flipkart.com/search?q=python+programming+books&otracker=search&otracker1=search&marketplace=FLIPKART&as-show=on&as=off&page=4,python programming
Hands-On MQTT Programming with Python,"English, Electronic book text, Hillar Gaston C.",https://rukminim1.flixcart.com/image/612/612/xif0q/book/c/c/q/hands-on-mqtt-programming-with-python-original-imagmfgzs5thceaf.jpeg?q=70,"₹2,899",,,https://www.flipkart.com/search?q=python+programming+books&otracker=search&otracker1=search&marketplace=FLIPKART&as-show=on&as=off&page=4,python programming
QGIS Python Programming Cookbook,"English, Electronic book text, Lawhead Joel",https://rukminim1.flixcart.com/image/612/612/book/9/8/5/qgis-python-programming-cookbook-original-imaekspfxx3zayny.jpeg?q=70,"₹4,099",,,https://www.flipkart.com/search?q=python+programming+books&otracker=search&otracker1=search&marketplace=FLIPKART&as-show=on&as=off&page=4,python programming
Python Programming in Context,"English, Paperback, Miller Bradley N.",https://rukminim1.flixcart.com/image/612/612/kihqz680-0/book/a/n/b/python-programming-in-context-original-imafy9yzng6y9jgw.jpeg?q=70,"₹2,590",,,https://www.flipkart.com/search?q=python+programming+books&otracker=search&otracker1=search&marketplace=FLIPKART&as-show=on&as=off&page=4,python programming
Complete Beginner Level Python Programming,"English, Paperback, Firdouse Banu",https://rukminim1.flixcart.com/image/612/612/kyyqpow0/book/f/y/j/complete-beginner-level-python-programming-original-imagb38fycbv5pkg.jpeg?q=70,₹287,,,https://www.flipkart.com/search?q=python+programming+books&otracker=search&otracker1=search&marketplace=FLIPKART&as-show=on&as=off&page=4,python programming
Advanced Python Programming,"Paperback, Dr. Vinodh P Vijayan Dr. Sankata Bhanjan Prusty Dr. A. Vijaya Kumar Dr. M. Madiajagan",https://rukminim1.flixcart.com/image/612/612/xif0q/book/b/p/n/advanced-python-programming-original-imaghf7mvmz3gfd7.jpeg?q=70,₹900,,,https://www.flipkart.com/search?q=python+programming+books&otracker=search&otracker1=search&marketplace=FLIPKART&as-show=on&as=off&page=4,python programming
PYTHON PROGRAMMING : Physics (PH-3510 SEC-H) (TYBSc Semester 5),"Paperback, Dr. Ramesh B. Bhise, Dr. Pradip V. Patil, Dr. Manisha D. Dhiware, Dr. Sukdev L. Kadam, Dr. Upendra D. Lad",https://rukminim1.flixcart.com/image/612/612/xif0q/book/r/o/r/python-programming-physics-ph-3510-sec-h-tybsc-semester-5-original-imagk3daxygh4rdd.jpeg?q=70,₹150,,,https://www.flipkart.com/search?q=python+programming+books&otracker=search&otracker1=search&marketplace=FLIPKART&as-show=on&as=off&page=4,python programming
Learn Raspberry Pi Programming With Python Second Edition,"English, Paperback, Wolfram Donat",https://rukminim1.flixcart.com/image/612/612/jxrv4i80/book/3/4/2/learn-raspberry-pi-programming-with-python-second-edition-original-imafhvszjbwcchyu.jpeg?q=70,₹703,,,https://www.flipkart.com/search?q=python+programming+books&otracker=search&otracker1=search&marketplace=FLIPKART&as-show=on&as=off&page=4,python programming
Python Programming Essentials for Artificial Intelligence and Machine Learning,"Paperback, Mr. NAVEEN CHAKRAVARTHY SATTARU Ms. SHWETA V.K PANDEY Mr. VINAY KUMAR KOPPARTY Mrs. SIRISHA VELURI",https://rukminim1.flixcart.com/image/612/612/l1tmf0w0/book/u/u/o/python-programming-essentials-for-artificial-intelligence-and-original-imagda7bfpvb8x5b.jpeg?q=70,₹700,,,https://www.flipkart.com/search?q=python+programming+books&otracker=search&otracker1=search&marketplace=FLIPKART&as-show=on&as=off&page=4,python programming
Absolute Beginner Python Programming,"Paperback, Menal Dahiya, Kumar Gaurav, Neetu Anand, Nikita Malik",https://rukminim1.flixcart.com/image/612/612/ky1vl3k0/book/i/o/c/absolute-beginner-python-programming-original-imagad63dbvpcnwk.jpeg?q=70,₹347,,,https://www.flipkart.com/search?q=python+programming+books&otracker=search&otracker1=search&marketplace=FLIPKART&as-show=on&as=off&page=4,python programming
Problem Solving and Python Programming,"English, Paperback, S R Boselin Prabhu, R Reka, N Dhasarathan, Mrs K Saraswathi",https://rukminim1.flixcart.com/image/612/612/jrgo4280/book/5/1/3/problem-solving-and-python-programming-original-imafd8f7qtkgfjz5.jpeg?q=70,₹200,,,https://www.flipkart.com/search?q=python+programming+books&otracker=search&otracker1=search&marketplace=FLIPKART&as-show=on&as=off&page=4,python programming
PROGRAMMING IN PYTHON-2 : SEC: MT-3610 (Third Year TY BSc / BA Mathematics Semester 6),"Paperback, Dr. Kalyanrao Takale, Dr. Amjad Shaikh, Prof. Krishna Ghode, Dr. Shrikisan Gaikwad, Prof. Patil",https://rukminim1.flixcart.com/image/612/612/l1xwqkw0/book/2/l/d/programming-in-python-2-sec-mt-3610-third-year-ty-bsc-ba-original-imagdecmckmafbuf.jpeg?q=70,₹120,,,https://www.flipkart.com/search?q=python+programming+books&otracker=search&otracker1=search&marketplace=FLIPKART&as-show=on&as=off&page=4,python programming
"PYTHON PROGRAMMING - DBATU (Second Year SY B.Tech Semester 4, Electronics & Telecommunication Engineering / Electrical and Electrical (Sandwich))","Paperback, Dr. Archana K. Ratnaparakhi, Aparna B. Barbadekar, Dr. Smita Chaudhari, Nitin N. Sakhare",https://rukminim1.flixcart.com/image/612/612/xif0q/book/r/y/o/python-programming-dbatu-second-year-sy-b-tech-semester-4-original-imagh2s7bymmb4gy.jpeg?q=70,₹200,,,https://www.flipkart.com/search?q=python+programming+books&otracker=search&otracker1=search&marketplace=FLIPKART&as-show=on&as=off&page=4,python programming
"{Set of 2 Books} B.Sc. Electronic Science - SY Semester 4 - As per SPPU's 2020 CBCS Pattern [ANALOG CIRCUIT DESIGN (EL-241) (Paper 1) , MICROCONTROLLER AND PYTHON PROGRAMMING (EL-242) (Paper 2)]","Paperback, Prof. (Dr.) P. B. Buchade, Dr. J. A. Bangali, Prof. (Dr.) M. L. Dongare, S. R. Chaudhari",https://rukminim1.flixcart.com/image/612/612/kjkbv680-0/book/f/5/v/set-of-2-books-b-sc-electronic-science-sy-semester-4-as-per-sppu-original-imafz4393vbf3sba.jpeg?q=70,₹160,4.8,(4),https://www.flipkart.com/search?q=python+programming+books&otracker=search&otracker1=search&marketplace=FLIPKART&as-show=on&as=off&page=4,python programming
