book_title,author,img,price,ratings,no_of_purchase,url,genre
Best Motivational Books in Gujarati - Ikigai + The Power Of Your Subconscious Mind,"Paperback, Keira Miki, Dr. Joseph Murphy",https://rukminim1.flixcart.com/image/612/612/xif0q/book/9/s/d/best-motivational-books-in-gujarati-ikigai-the-power-of-your-original-imaghf4uwnxf5v5u.jpeg?q=70,₹306,,,https://www.flipkart.com/search?q=motivation+books&otracker=search&otracker1=search&marketplace=FLIPKART&as-show=on&as=off&page=17,motivation
Sustainable Action and Motivation,"English, Hardcover, Mees Roland",https://rukminim1.flixcart.com/image/612/612/xif0q/book/v/d/w/sustainable-action-and-motivation-original-imagn4ynsdm9zxwy.jpeg?q=70,"₹13,098",,,https://www.flipkart.com/search?q=motivation+books&otracker=search&otracker1=search&marketplace=FLIPKART&as-show=on&as=off&page=17,motivation
Asanthiyute Poomaram,"Malayalam, Paperback, Vattakkunnel Denny Thomas",https://rukminim1.flixcart.com/image/612/612/k4hcjgw0/book/7/0/9/asanthiyute-poomaram-original-imafndvgn4z8tahq.jpeg?q=70,₹115,,,https://www.flipkart.com/search?q=motivation+books&otracker=search&otracker1=search&marketplace=FLIPKART&as-show=on&as=off&page=17,motivation
Scanner Green Edition for Financial Accounting (Paper 6 | CMA Inter Group 1) - Including questions and solutions of December 2022 | 2022 Syllabus | New Syllabus | June 2023 Exam,"Shuchita Prakashan (P) Ltd., Prof. Arun Kumar, CA Mohit Bahal, CS (Dr.) Himanshu Srivastava",https://rukminim1.flixcart.com/image/612/612/xif0q/book/d/b/b/scanner-green-edition-for-financial-accounting-paper-6-cma-inter-original-imagmqnxzakdrxvw.jpeg?q=70,₹195,,,https://www.flipkart.com/search?q=motivation+books&otracker=search&otracker1=search&marketplace=FLIPKART&as-show=on&as=off&page=17,motivation
Vaidhyayogini Motivational Stories Towards Empowerment Volume-1,"Paperback, Faculty Of Ayurved",https://rukminim1.flixcart.com/image/612/612/l0bbonk0/book/o/0/o/vaidhyayogini-motivational-stories-towards-empowerment-volume-1-original-imagc4pmwjbyhk5g.jpeg?q=70,₹222,,,https://www.flipkart.com/search?q=motivation+books&otracker=search&otracker1=search&marketplace=FLIPKART&as-show=on&as=off&page=17,motivation
You Can If You Think You Can,"English, Paperback, Peale Norman Vincent",https://rukminim1.flixcart.com/image/612/612/kufuikw0/book/g/g/9/you-can-if-you-think-you-can-original-imag7jveggdpanfc.jpeg?q=70,₹245,4.5,(51),https://www.flipkart.com/search?q=motivation+books&otracker=search&otracker1=search&marketplace=FLIPKART&as-show=on&as=off&page=17,motivation
Success Through A Positive Mental Attitude,"English, Paperback, Hill Napoleon",https://rukminim1.flixcart.com/image/612/612/l2hwwi80/book/8/f/7/success-through-a-positive-mental-attitude-original-imagdtmnr9f856az.jpeg?q=70,₹336,4.5,"(1,948)",https://www.flipkart.com/search?q=motivation+books&otracker=search&otracker1=search&marketplace=FLIPKART&as-show=on&as=off&page=17,motivation
Scanner Cost Accounting (Paper 8 | Group 1) | 2022 Syllabus | June 2023 Exam,"Shuchita Prakashan (P) Ltd., Prof. Arun Kumar, CA Mohit Bahal, CS (Dr.) Himanshu Srivastava",https://rukminim1.flixcart.com/image/612/612/xif0q/book/h/z/c/scanner-cost-accounting-paper-8-group-1-2022-syllabus-june-2023-original-imagmv88p9xgmffg.jpeg?q=70,₹260,,,https://www.flipkart.com/search?q=motivation+books&otracker=search&otracker1=search&marketplace=FLIPKART&as-show=on&as=off&page=17,motivation
Unshakeable,"English, Hardcover, Robbins Tony",https://rukminim1.flixcart.com/image/612/612/ki6bgcw0-0/book/g/6/c/unshakeable-original-imafyyjgzzgjzw8r.jpeg?q=70,₹840,4.4,(203),https://www.flipkart.com/search?q=motivation+books&otracker=search&otracker1=search&marketplace=FLIPKART&as-show=on&as=off&page=17,motivation
The Feeling Good Handbook,"English, Paperback, Burnes David D",https://rukminim1.flixcart.com/image/612/612/kv8fbm80/book/x/a/z/the-feeling-good-handbook-original-imag86synpxgj6bc.jpeg?q=70,"₹1,279",5,(8),https://www.flipkart.com/search?q=motivation+books&otracker=search&otracker1=search&marketplace=FLIPKART&as-show=on&as=off&page=17,motivation
Untamed,"English, Paperback, Doyle Glennon",https://rukminim1.flixcart.com/image/612/612/knxiavk0/book/b/r/k/untamed-original-imag2g2upcxg4jxh.jpeg?q=70,₹498,4.6,(66),https://www.flipkart.com/search?q=motivation+books&otracker=search&otracker1=search&marketplace=FLIPKART&as-show=on&as=off&page=17,motivation
The Power Of Your Subconscious Mind  - The Power of Your Subconscious Mind : Hindi Translation of International Bestseller “The Power of Your Subconscious Mind by Joseph Murphy” (Best Selling Books of All Time),"Paperback, Joseph Murphy",https://rukminim1.flixcart.com/image/612/612/krgohow0/book/4/g/6/the-power-of-your-subconscious-mind-original-imag58y9kgnwzzsh.jpeg?q=70,₹205,4.4,(757),https://www.flipkart.com/search?q=motivation+books&otracker=search&otracker1=search&marketplace=FLIPKART&as-show=on&as=off&page=17,motivation
71 Science Experiments,"English, Paperback, Khatri Vikas",https://rukminim1.flixcart.com/image/612/612/l3j2cnk0/book/i/9/j/-original-imagemu8thkcsy2q.jpeg?q=70,₹132,4.1,(38),https://www.flipkart.com/search?q=motivation+books&otracker=search&otracker1=search&marketplace=FLIPKART&as-show=on&as=off&page=17,motivation
The Best Books for Personal Transformation in Gujarati : The Richest Man in Babylon + As a Man Thinketh & Out from the Heart,"Paperback, George S. Clason, James Allen",https://rukminim1.flixcart.com/image/612/612/xif0q/book/9/a/i/the-best-books-for-personal-transformation-in-gujarati-the-original-imagghz3ydcgdhm6.jpeg?q=70,₹242,4.8,(4),https://www.flipkart.com/search?q=motivation+books&otracker=search&otracker1=search&marketplace=FLIPKART&as-show=on&as=off&page=17,motivation
Ikigai : Japanese Art of staying Young.. While growing Old + How to Win Friends & Influence People,"Paperback, Keira Miki, Dale Carnegie",https://rukminim1.flixcart.com/image/612/612/l5h2xe80/book/a/l/k/ikigai-japanese-art-of-staying-young-while-growing-old-how-to-original-imagg4vph4cxg45g.jpeg?q=70,₹298,5,(3),https://www.flipkart.com/search?q=motivation+books&otracker=search&otracker1=search&marketplace=FLIPKART&as-show=on&as=off&page=17,motivation
"Zero To Mastery In Python Programming, Best Python Book For Beginners, This Python Book Covers A-Z About Programming In Python, Also Comes With Python Tricks You Should Definietly Know, Latest Edition  - Zero To Mastery In Python Programming, Best Python Book For Beginners, This Python Book Covers A-Z About Programming In Python, Also Comes With Python Tricks You Should Definietly Know, Latest Edition (Paperback, RAKESH K. YADAV, SRINIVAS ARUKONDA, MONU SINGH) with 1 Disc","Paperback, RAKESH K. YADAV, SRINIVAS ARUKONDA, MONU SINGH",https://rukminim1.flixcart.com/image/612/612/kq8dua80/book/v/f/2/zero-to-mastery-in-python-programming-best-python-book-for-original-imag4ab2gzadhskq.jpeg?q=70,₹325,4.2,(280),https://www.flipkart.com/search?q=motivation+books&otracker=search&otracker1=search&marketplace=FLIPKART&as-show=on&as=off&page=17,motivation
Giving Effective Feedback (HBR 20-Minute Manager Series),"English, Paperback, Harvard Business Review",https://rukminim1.flixcart.com/image/612/612/ki96c280-0/book/h/d/x/giving-effective-feedback-hbr-20-minute-manager-series-original-imafy34hngh2nu9z.jpeg?q=70,₹209,3.5,(6),https://www.flipkart.com/search?q=motivation+books&otracker=search&otracker1=search&marketplace=FLIPKART&as-show=on&as=off&page=17,motivation
Motivation,"English, Paperback, Stothart Catherine",https://rukminim1.flixcart.com/image/612/612/l59xq4w0/book/e/h/g/motivation-original-imagfyznhxy5kaza.jpeg?q=70,"₹3,021",,,https://www.flipkart.com/search?q=motivation+books&otracker=search&otracker1=search&marketplace=FLIPKART&as-show=on&as=off&page=17,motivation
HBR's 10 Must Reads on High Performance,"English, Paperback, Harvard Business Review James",https://rukminim1.flixcart.com/image/612/612/kvvad8w0/book/n/u/f/hbr-s-10-must-reads-on-high-performance-original-imag8ny5gsrgdhbn.jpeg?q=70,₹600,,,https://www.flipkart.com/search?q=motivation+books&otracker=search&otracker1=search&marketplace=FLIPKART&as-show=on&as=off&page=17,motivation
Manusmriti,"Hindi, Paperback, Manu",https://rukminim1.flixcart.com/image/612/612/ki0loy80-0/book/7/r/k/manusmriti-original-imafxwmfw4asszj5.jpeg?q=70,₹338,4.4,(546),https://www.flipkart.com/search?q=motivation+books&otracker=search&otracker1=search&marketplace=FLIPKART&as-show=on&as=off&page=17,motivation
Self Improvement and Motivation For Success,"English, Paperback, Robot Hat",https://rukminim1.flixcart.com/image/612/612/ktizdzk0/book/s/u/w/self-improvement-and-motivation-for-success-original-imag6uzxdympyeke.jpeg?q=70,₹363,,,https://www.flipkart.com/search?q=motivation+books&otracker=search&otracker1=search&marketplace=FLIPKART&as-show=on&as=off&page=17,motivation
Motivation and Learning Strategies for College Success,"English, Hardcover, Seli Helena",https://rukminim1.flixcart.com/image/612/612/xif0q/book/e/3/q/motivation-and-learning-strategies-for-college-success-original-imagg634duf8xhzf.jpeg?q=70,"₹13,098",,,https://www.flipkart.com/search?q=motivation+books&otracker=search&otracker1=search&marketplace=FLIPKART&as-show=on&as=off&page=17,motivation
Motivational Cognitive Behavioural Therapy,"English, Paperback, Atkinson Cathy",https://rukminim1.flixcart.com/image/612/612/k40798w0/book/5/7/9/motivational-cognitive-behavioural-therapy-original-imafnygytx5p2tqh.jpeg?q=70,"₹1,712",,,https://www.flipkart.com/search?q=motivation+books&otracker=search&otracker1=search&marketplace=FLIPKART&as-show=on&as=off&page=17,motivation
SSC Reasoning Topic-wise Practice Sets Book For Exam 2022 (English Medium),"Paperback, Radian Book Company",https://rukminim1.flixcart.com/image/612/612/l2z26q80/book/z/1/z/ssc-reasoning-topic-wise-practice-sets-book-for-exam-2022-from-original-image6r4x5agfwz3.jpeg?q=70,₹160,4.2,(288),https://www.flipkart.com/search?q=motivation+books&otracker=search&otracker1=search&marketplace=FLIPKART&as-show=on&as=off&page=17,motivation
Kamyab Safarnama,"Hindi, Paperback, Lt Col (Dr) Girijesh Saxena",https://rukminim1.flixcart.com/image/612/612/book/4/1/7/kamyab-safarnama-original-imaez85fb9mddpfd.jpeg?q=70,₹230,4.3,(3),https://www.flipkart.com/search?q=motivation+books&otracker=search&otracker1=search&marketplace=FLIPKART&as-show=on&as=off&page=17,motivation
How to Host a Viking Funeral,"English, Hardcover, Scheele Kyle",https://rukminim1.flixcart.com/image/612/612/krwec280/book/j/s/l/how-to-host-a-viking-funeral-original-imag5hdwsvjdtzav.jpeg?q=70,"₹1,049",,,https://www.flipkart.com/search?q=motivation+books&otracker=search&otracker1=search&marketplace=FLIPKART&as-show=on&as=off&page=17,motivation
Le Trajet,"English, Paperback, Henrilus Yvon J Dr",https://rukminim1.flixcart.com/image/612/612/kzfvzww0/book/b/7/z/le-trajet-original-imagbghkjhvpe8bh.jpeg?q=70,₹684,,,https://www.flipkart.com/search?q=motivation+books&otracker=search&otracker1=search&marketplace=FLIPKART&as-show=on&as=off&page=17,motivation
Motivating Thoughts of Swami Vivekananda,"English, Paperback, Vivekananda Swami",https://rukminim1.flixcart.com/image/612/612/xif0q/book/s/t/l/motivating-thoughts-of-swami-vivekananda-original-imaggnmk9edg2g9b.jpeg?q=70,₹144,4.5,(57),https://www.flipkart.com/search?q=motivation+books&otracker=search&otracker1=search&marketplace=FLIPKART&as-show=on&as=off&page=17,motivation
As She Walked,"English, Paperback, Cain Evangeline",https://rukminim1.flixcart.com/image/612/612/l3lx8cw0/book/f/d/e/as-she-walked-original-imagezttkhgsh5yy.jpeg?q=70,₹727,,,https://www.flipkart.com/search?q=motivation+books&otracker=search&otracker1=search&marketplace=FLIPKART&as-show=on&as=off&page=17,motivation
How to Be You,"English, Paperback, Marsh Jeffrey",https://rukminim1.flixcart.com/image/612/612/xif0q/book/v/3/y/how-to-be-you-original-imagksrkfzuagxfh.jpeg?q=70,₹416,,,https://www.flipkart.com/search?q=motivation+books&otracker=search&otracker1=search&marketplace=FLIPKART&as-show=on&as=off&page=17,motivation
Make it Happen,"English, Paperback, George Amika",https://rukminim1.flixcart.com/image/612/612/kuyf8nk0/book/k/w/7/make-it-happen-original-imag7yxg7vfpnjb7.jpeg?q=70,₹440,,,https://www.flipkart.com/search?q=motivation+books&otracker=search&otracker1=search&marketplace=FLIPKART&as-show=on&as=off&page=17,motivation
Investonomy,"Hindi, Paperback, Kamra Pranjal",https://rukminim1.flixcart.com/image/612/612/kq6yefk0/book/b/d/l/investonomy-ameer-banane-ki-stock-market-guide-original-imag49b7vbhh4s4a.jpeg?q=70,₹209,4.3,(692),https://www.flipkart.com/search?q=motivation+books&otracker=search&otracker1=search&marketplace=FLIPKART&as-show=on&as=off&page=17,motivation
The Best Books for Personal Transformation in Gujarati : The Richest Man in Babylon + Think And Grow Rich + The Power Of Your Subconscious Mind + How to Win Friends & Influence People,"Paperback, George S. Clason, Napoleon Hill, Joseph Murphy, Dale Carnegie",https://rukminim1.flixcart.com/image/612/612/xif0q/book/k/g/x/the-best-books-for-personal-transformation-in-gujarati-the-original-imagghz3rqwzuehz.jpeg?q=70,₹536,,,https://www.flipkart.com/search?q=motivation+books&otracker=search&otracker1=search&marketplace=FLIPKART&as-show=on&as=off&page=17,motivation
Best Motivational Books In English - Ikigai + How to Stop Worrying & Start Living,"Paperback, Keira Miki, Dale Carnegie",https://rukminim1.flixcart.com/image/612/612/l5h2xe80/book/5/v/a/best-motivational-books-in-english-ikigai-how-to-stop-worrying-original-imagg4vpbuyuwzhj.jpeg?q=70,₹298,4.7,(12),https://www.flipkart.com/search?q=motivation+books&otracker=search&otracker1=search&marketplace=FLIPKART&as-show=on&as=off&page=17,motivation
Orchestrating Value,"English, Paperback, Arlotto Pam",https://rukminim1.flixcart.com/image/612/612/xif0q/book/i/r/x/orchestrating-value-original-imagjwz7ctczkxsx.jpeg?q=70,"₹4,936",,,https://www.flipkart.com/search?q=motivation+books&otracker=search&otracker1=search&marketplace=FLIPKART&as-show=on&as=off&page=17,motivation
SURA'S SSC MTS (Multi Tasking Staff) Exam Book in English Medium - Latest Updated Edition 2023,"Paperback, V.V.K SUBBURAJ",https://rukminim1.flixcart.com/image/612/612/xif0q/book/2/y/v/sura-s-ssc-mts-multi-tasking-staff-exam-book-in-english-medium-original-imagmfc7yahnbwmz.jpeg?q=70,₹261,4.1,(53),https://www.flipkart.com/search?q=motivation+books&otracker=search&otracker1=search&marketplace=FLIPKART&as-show=on&as=off&page=17,motivation
Stellar Management Teams,"English, Paperback, Ristikangas Vesa",https://rukminim1.flixcart.com/image/612/612/xif0q/book/z/d/o/stellar-management-teams-original-imagg5trdrzzkjyb.jpeg?q=70,"₹2,510",,,https://www.flipkart.com/search?q=motivation+books&otracker=search&otracker1=search&marketplace=FLIPKART&as-show=on&as=off&page=17,motivation
Tribal Leadership,"English, Paperback, Logan Dave",https://rukminim1.flixcart.com/image/612/612/kkh6zrk0/book/4/l/k/tribal-leadership-original-imafztgtua38unrv.jpeg?q=70,₹747,4.3,(4),https://www.flipkart.com/search?q=motivation+books&otracker=search&otracker1=search&marketplace=FLIPKART&as-show=on&as=off&page=17,motivation
Motivational Cognitive Behavioural Therapy,"English, Hardcover, Atkinson Cathy",https://rukminim1.flixcart.com/image/612/612/k40798w0/book/5/7/9/motivational-cognitive-behavioural-therapy-original-imafnygytx5p2tqh.jpeg?q=70,"₹13,098",,,https://www.flipkart.com/search?q=motivation+books&otracker=search&otracker1=search&marketplace=FLIPKART&as-show=on&as=off&page=17,motivation
Scanner Green Edition for Indirect Taxation (Paper 11 | CMA Inter Group 2) - Including questions and solutions of December 2022 | 2016 Syllabus | CMA Inter Group-2 | June 2023 Exam,"Shuchita Prakashan (P) Ltd., Prof. Arun Kumar, CS CA Rajiv Singh",https://rukminim1.flixcart.com/image/612/612/xif0q/book/f/d/y/scanner-green-edition-for-indirect-taxation-paper-11-cma-inter-original-imagmqnjvxsv4dej.jpeg?q=70,₹200,4.3,(16),https://www.flipkart.com/search?q=motivation+books&otracker=search&otracker1=search&marketplace=FLIPKART&as-show=on&as=off&page=17,motivation
