book_title,author,img,price,ratings,no_of_purchase,url,genre
Swift Data Structure and Algorithms,"English, Electronic book text, Azar Erik",https://rukminim1.flixcart.com/image/612/612/jovshow0/book/5/0/4/swift-data-structure-and-algorithms-original-imafb954rdzwazhb.jpeg?q=70,"₹3,299",,,https://www.flipkart.com/search?q=data+structure+and+algorithms+books&otracker=search&otracker1=search&marketplace=FLIPKART&as-show=on&as=off&page=1,data structure and algorithms
IGNOU MCS 208 Solved Guess Papers From IGNOU Study Material/Help Book/Guidebook Titled Data Structures And Algorithms For Exam Preparations (Latest Syllabus) IGNOU PGDCA New Mcs208,"Paperback, BHAVYA KUMAR SAHNI",https://rukminim1.flixcart.com/image/612/612/xif0q/regionalbooks/n/w/b/ignou-mcs-208-help-book-data-structures-and-algorithms-ignou-original-imaggxfyztcju2rw.jpeg?q=70,₹99,,,https://www.flipkart.com/search?q=data+structure+and+algorithms+books&otracker=search&otracker1=search&marketplace=FLIPKART&as-show=on&as=off&page=1,data structure and algorithms
IGNOU MCS 208 Help Book Data Structures And Algorithms (IGNOU Study Notes/Guidebook Chapter-Wise) With Solved Latest Previous Year Question Papers IGNOU PGDCA New Syllabus 2nd Semester Mcs208,"Paperback, BHAVYA KUMAR SAHNI",https://rukminim1.flixcart.com/image/612/612/xif0q/regionalbooks/n/w/b/ignou-mcs-208-help-book-data-structures-and-algorithms-ignou-original-imaggxfyztcju2rw.jpeg?q=70,₹149,,,https://www.flipkart.com/search?q=data+structure+and+algorithms+books&otracker=search&otracker1=search&marketplace=FLIPKART&as-show=on&as=off&page=1,data structure and algorithms
C++ Data Structures and Algorithms,"English, Electronic book text, Anggoro Wisnu",https://rukminim1.flixcart.com/image/612/612/xif0q/book/b/v/6/c-data-structures-and-algorithms-original-imagmfcmj8wzgzrx.jpeg?q=70,"₹1,783",,,https://www.flipkart.com/search?q=data+structure+and+algorithms+books&otracker=search&otracker1=search&marketplace=FLIPKART&as-show=on&as=off&page=1,data structure and algorithms
Java 9 Data Structures and Algorithms,"English, Electronic book text, Chawdhuri Debasish Ray",https://rukminim1.flixcart.com/image/612/612/jovshow0/book/3/4/9/java-9-data-structures-and-algorithms-original-imafb93p2casu3xn.jpeg?q=70,"₹3,299",5,(3),https://www.flipkart.com/search?q=data+structure+and+algorithms+books&otracker=search&otracker1=search&marketplace=FLIPKART&as-show=on&as=off&page=1,data structure and algorithms
R Data Structures and Algorithms,"English, Electronic book text, Prakash Dr. PKS",https://rukminim1.flixcart.com/image/612/612/jokcyvk0/book/1/5/3/r-data-structures-and-algorithms-original-imafazxf86jkssfk.jpeg?q=70,"₹3,299",,,https://www.flipkart.com/search?q=data+structure+and+algorithms+books&otracker=search&otracker1=search&marketplace=FLIPKART&as-show=on&as=off&page=1,data structure and algorithms
C# Data Structures and Algorithms,"English, Electronic book text, Jamro Marcin",https://rukminim1.flixcart.com/image/612/612/xif0q/book/e/u/v/c-data-structures-and-algorithms-original-imagmfcxauvhfhzt.jpeg?q=70,"₹4,099",,,https://www.flipkart.com/search?q=data+structure+and+algorithms+books&otracker=search&otracker1=search&marketplace=FLIPKART&as-show=on&as=off&page=1,data structure and algorithms
PHP 7 Data Structures and Algorithms,"English, Electronic book text, Rahman Mizanur",https://rukminim1.flixcart.com/image/612/612/jokcyvk0/book/8/9/0/php-7-data-structures-and-algorithms-original-imafbyyx5jgk6zp5.jpeg?q=70,"₹3,599",2.5,(2),https://www.flipkart.com/search?q=data+structure+and+algorithms+books&otracker=search&otracker1=search&marketplace=FLIPKART&as-show=on&as=off&page=1,data structure and algorithms
Python Data Structures and Algorithms,"English, Electronic book text, Baka Benjamin",https://rukminim1.flixcart.com/image/612/612/l29c9e80/book/s/m/b/python-data-structures-and-algorithms-original-imagdn4rucmqkxzj.jpeg?q=70,"₹3,599",5,(3),https://www.flipkart.com/search?q=data+structure+and+algorithms+books&otracker=search&otracker1=search&marketplace=FLIPKART&as-show=on&as=off&page=1,data structure and algorithms
Learning F# Functional Data Structures and Algorithms,"English, Electronic book text, Masood Adnan Ph.D.",https://rukminim1.flixcart.com/image/612/612/book/4/7/6/learning-f-functional-data-structures-and-algorithms-original-imaekspfmybevpgu.jpeg?q=70,"₹3,299",,,https://www.flipkart.com/search?q=data+structure+and+algorithms+books&otracker=search&otracker1=search&marketplace=FLIPKART&as-show=on&as=off&page=1,data structure and algorithms
Learning JavaScript Data Structures and Algorithms,"English, Electronic book text, Groner Loiane",https://rukminim1.flixcart.com/image/612/612/xif0q/book/t/s/8/learning-javascript-data-structures-and-algorithms-original-imagmfcuzbpxsrcx.jpeg?q=70,"₹2,217",3.5,(4),https://www.flipkart.com/search?q=data+structure+and+algorithms+books&otracker=search&otracker1=search&marketplace=FLIPKART&as-show=on&as=off&page=1,data structure and algorithms
Learning Functional Data Structures and Algorithms,"English, Electronic book text, Khot Atul S.",https://rukminim1.flixcart.com/image/612/612/jokcyvk0/book/7/3/1/learning-functional-data-structures-and-algorithms-original-imafazwj6zpmky6a.jpeg?q=70,"₹3,599",,,https://www.flipkart.com/search?q=data+structure+and+algorithms+books&otracker=search&otracker1=search&marketplace=FLIPKART&as-show=on&as=off&page=1,data structure and algorithms
Clojure Data Structures and Algorithms Cookbook,"English, Electronic book text, Naccache Rafik",https://rukminim1.flixcart.com/image/612/612/jpu324w0/book/4/5/7/clojure-data-structures-and-algorithms-cookbook-original-imafbzpynakgckyf.jpeg?q=70,"₹1,647",,,https://www.flipkart.com/search?q=data+structure+and+algorithms+books&otracker=search&otracker1=search&marketplace=FLIPKART&as-show=on&as=off&page=1,data structure and algorithms
Algorithms and Data Structures - Applications to Graphics and Geometry,"English, Paperback, Textbook Equity",https://rukminim1.flixcart.com/image/612/612/kkyc9zk0/book/v/7/j/algorithms-and-data-structures-applications-to-graphics-and-original-imagy64yf7mhdd3w.jpeg?q=70,"₹4,667",,,https://www.flipkart.com/search?q=data+structure+and+algorithms+books&otracker=search&otracker1=search&marketplace=FLIPKART&as-show=on&as=off&page=1,data structure and algorithms
Data Structure Algorithms And Analysis,"Paperback, Dr. Ashwin Mehta",https://rukminim1.flixcart.com/image/612/612/kq9ta4w0/book/j/0/t/data-structure-algorithms-and-analysis-original-imag4bau2beyjydq.jpeg?q=70,₹525,,,https://www.flipkart.com/search?q=data+structure+and+algorithms+books&otracker=search&otracker1=search&marketplace=FLIPKART&as-show=on&as=off&page=1,data structure and algorithms
Data Structure & Algorithms For SPPU Sem 3 Information Technology Course Code :(Code - 214443) Academic Year 2020-2021,"Paperback, Pankaj B. Brahmankar",https://rukminim1.flixcart.com/image/612/612/xif0q/regionalbooks/j/z/6/data-structure-algorithms-for-sppu-sem-3-information-technology-original-imagg8kjvqxu2wzr.jpeg?q=70,₹450,,,https://www.flipkart.com/search?q=data+structure+and+algorithms+books&otracker=search&otracker1=search&marketplace=FLIPKART&as-show=on&as=off&page=1,data structure and algorithms
Data Structure and Algorithmic Thinking with Python,"English, Paperback, Karumanchi Narasimha",https://rukminim1.flixcart.com/image/612/612/k45x0nk0/book/5/9/2/data-structure-and-algorithmic-thinking-with-python-original-imafnfd8dqfshrhy.jpeg?q=70,₹629,4.5,(541),https://www.flipkart.com/search?q=data+structure+and+algorithms+books&otracker=search&otracker1=search&marketplace=FLIPKART&as-show=on&as=off&page=1,data structure and algorithms
Data Structure and Algorithms,"English, Paperback, Anuradha",https://rukminim1.flixcart.com/image/612/612/xif0q/book/t/3/g/data-structure-and-algorithms-original-imagjw28eszzb9eh.jpeg?q=70,₹251,,,https://www.flipkart.com/search?q=data+structure+and+algorithms+books&otracker=search&otracker1=search&marketplace=FLIPKART&as-show=on&as=off&page=1,data structure and algorithms
DATA STRUCTURE AND ALGORITHMS - Second Year SE Degree Course in Artificial Intelligence and Machine Learning - Semester 3 - SPPU,"Paperback, Vikas B. Maral, Nitin N. Sakhare, Rushikesh S. Tanksale, Mr. Rupesh G. Mahajan",https://rukminim1.flixcart.com/image/612/612/xif0q/book/9/r/j/data-structure-and-algorithms-second-year-se-degree-course-in-original-imagjs9rbgmhgfth.jpeg?q=70,₹340,,,https://www.flipkart.com/search?q=data+structure+and+algorithms+books&otracker=search&otracker1=search&marketplace=FLIPKART&as-show=on&as=off&page=1,data structure and algorithms
Data Structure And Analysis Of Algorithm,"English, Paperback, Goyal Krishan Kumar",https://rukminim1.flixcart.com/image/612/612/xif0q/book/6/2/6/data-structure-and-analysis-of-algorithm-original-imagjy2edyp9kn7w.jpeg?q=70,₹695,,,https://www.flipkart.com/search?q=data+structure+and+algorithms+books&otracker=search&otracker1=search&marketplace=FLIPKART&as-show=on&as=off&page=1,data structure and algorithms
"Data Structures and Algorithms with JavaScript (English, Paperback, McMillan Michael)","English, Paperback, McMillan Michael",https://rukminim1.flixcart.com/image/612/612/kjn6qvk0-0/book/p/c/k/data-structures-and-algorithms-with-javascript-original-imafz5dygnuq2dhn.jpeg?q=70,₹850,4.3,(19),https://www.flipkart.com/search?q=data+structure+and+algorithms+books&otracker=search&otracker1=search&marketplace=FLIPKART&as-show=on&as=off&page=1,data structure and algorithms
Data Structures and Algorithms in Java,"Paperback, Michael T. Goodrich, Roberto Tamassia, Michael H. Goldwasser, Subhasish Banerjee",https://rukminim1.flixcart.com/image/612/612/l58iaa80/book/q/0/3/data-structures-and-algorithms-in-java-original-imagfyhgds5gmayf.jpeg?q=70,₹765,,,https://www.flipkart.com/search?q=data+structure+and+algorithms+books&otracker=search&otracker1=search&marketplace=FLIPKART&as-show=on&as=off&page=1,data structure and algorithms
Data Structure and Algorithm,"English, Paperback, Prof. Rukadikar Maria S.",https://rukminim1.flixcart.com/image/612/612/book/5/5/3/data-structure-algorithm-rukadikar-original-imaefwq5gvqvehyc.jpeg?q=70,₹675,,,https://www.flipkart.com/search?q=data+structure+and+algorithms+books&otracker=search&otracker1=search&marketplace=FLIPKART&as-show=on&as=off&page=1,data structure and algorithms
IGNOU MCSL 209 Solved Assignment 2022-23 Data Structures And Algorithms Lab IGNOU Solved Assignment PGDCA New 2nd Semester IGNOU Post Graduate Diploma In Computer Applications (2022-2023) Mcsl209,"Paperback, BHAVYA KUMAR SAHNI",https://rukminim1.flixcart.com/image/612/612/xif0q/regionalbooks/0/p/m/ignou-mcsl-209-solved-assignment-2022-23-data-structures-and-original-imagj8fgar9rhwft.jpeg?q=70,₹99,,,https://www.flipkart.com/search?q=data+structure+and+algorithms+books&otracker=search&otracker1=search&marketplace=FLIPKART&as-show=on&as=off&page=1,data structure and algorithms
Data Structures & Algorithms Using C 5 Edition,"English, Paperback, Salaria",https://rukminim1.flixcart.com/image/612/612/ku4ezrk0/book/e/u/o/data-structures-algorithms-using-c-original-imag7b7fkgegtyrf.jpeg?q=70,₹284,4.5,(138),https://www.flipkart.com/search?q=data+structure+and+algorithms+books&otracker=search&otracker1=search&marketplace=FLIPKART&as-show=on&as=off&page=1,data structure and algorithms
"Data Structures & Algorithms Using C++  - Theory, Design and Object Oriented Implementation 3 Edition","English, Paperback, Salaria R. S.",https://rukminim1.flixcart.com/image/612/612/ku4ezrk0/book/h/h/i/data-structures-algorithms-using-c-original-imag7b7fzhrqev53.jpeg?q=70,₹284,4.4,(114),https://www.flipkart.com/search?q=data+structure+and+algorithms+books&otracker=search&otracker1=search&marketplace=FLIPKART&as-show=on&as=off&page=1,data structure and algorithms
IGNOU MCS 208 Previous Year Solved Question Paper (December 2021) Data Structures And Algorithms IGNOU PGDCA NEW 2nd Semester IGNOU Post Graduate Diploma In Computer Applications Mcs208,"Paperback, BHAVYA KUMAR SAHNI",https://rukminim1.flixcart.com/image/612/612/xif0q/regionalbooks/n/w/b/ignou-mcs-208-help-book-data-structures-and-algorithms-ignou-original-imaggxfyztcju2rw.jpeg?q=70,₹99,,,https://www.flipkart.com/search?q=data+structure+and+algorithms+books&otracker=search&otracker1=search&marketplace=FLIPKART&as-show=on&as=off&page=1,data structure and algorithms
IGNOU MCS 208 Solved Assignment 2022-23 Data Structures And Algorithms IGNOU Solved Assignment PGDCA New 2nd Semester IGNOU Post Graduate Diploma In Computer Applications (2022-2023) Mcs208,"Paperback, BHAVYA KUMAR SAHNI",https://rukminim1.flixcart.com/image/612/612/xif0q/regionalbooks/y/8/i/ignou-mcs-208-solved-assignment-2022-23-data-structures-and-original-imagj8f6pshzukhk.jpeg?q=70,₹99,,,https://www.flipkart.com/search?q=data+structure+and+algorithms+books&otracker=search&otracker1=search&marketplace=FLIPKART&as-show=on&as=off&page=1,data structure and algorithms
Data Structures and Algorithms Made Easy,"English, Paperback, Karumanchi Narasimha",https://rukminim1.flixcart.com/image/612/612/k3erngw0/book/2/7/9/data-structures-and-algorithms-made-easy-original-imafmjfpfkcsvszs.jpeg?q=70,₹608,4.5,"(5,465)",https://www.flipkart.com/search?q=data+structure+and+algorithms+books&otracker=search&otracker1=search&marketplace=FLIPKART&as-show=on&as=off&page=1,data structure and algorithms
Data Structures and Algorithms Made Easy in Java,"English, Paperback, Karumanchi Narasimha",https://rukminim1.flixcart.com/image/612/612/k3erngw0/book/5/5/4/data-structures-and-algorithms-made-easy-in-java-original-imafmjfpvpspcfqn.jpeg?q=70,₹603,4.3,"(2,452)",https://www.flipkart.com/search?q=data+structure+and+algorithms+books&otracker=search&otracker1=search&marketplace=FLIPKART&as-show=on&as=off&page=1,data structure and algorithms
Data Structure & Algorithm For MU Sem 5 Electronics And Telecommunication EngineeringCourse Code :ECCDLO5014 Academic Year 2021-2022,"Paperback, Pankaj B. Brahmankar, Prof. Dipali K. Pawar",https://rukminim1.flixcart.com/image/612/612/l5iid8w0/regionalbooks/k/r/p/data-structure-algorithm-for-mu-sem-5-electronics-and-original-imagg6agqczefvpp.jpeg?q=70,₹395,,,https://www.flipkart.com/search?q=data+structure+and+algorithms+books&otracker=search&otracker1=search&marketplace=FLIPKART&as-show=on&as=off&page=1,data structure and algorithms
"Data Structures And Algorithms For MU Sem 3 Electronics And Computer Science Course Code ECC 304 
Academic Year 2020-2021","Paperback, Pankaj B. Brahmankar, Pankaj S. Desai",https://rukminim1.flixcart.com/image/612/612/xif0q/regionalbooks/n/c/9/data-structures-and-algorithms-for-mu-sem-3-electronics-and-original-imaghnk2dhgre98n.jpeg?q=70,₹325,,,https://www.flipkart.com/search?q=data+structure+and+algorithms+books&otracker=search&otracker1=search&marketplace=FLIPKART&as-show=on&as=off&page=1,data structure and algorithms
Data Structures And Algorithms NEW SYALLUBUS 2021 (Savitribai Phule Pune University Computer Engineering(COMP) Sem 4,"Hardcover, Brahmankar Pankaj B.",https://rukminim1.flixcart.com/image/612/612/km57hjk0/regionalbooks/7/c/x/data-structures-and-algorithms-new-syallubus-2021-savitribai-original-imagf3vydsbchsky.jpeg?q=70,₹180,4,(7),https://www.flipkart.com/search?q=data+structure+and+algorithms+books&otracker=search&otracker1=search&marketplace=FLIPKART&as-show=on&as=off&page=1,data structure and algorithms
"Data Structures,Algorithms&Applications Inc++","Paperback, sahni Sarta",https://rukminim1.flixcart.com/image/612/612/xif0q/regionalbooks/j/7/o/data-structures-algorithms-applications-inc-original-imagjs7zbhhxfmd5.jpeg?q=70,₹780,,,https://www.flipkart.com/search?q=data+structure+and+algorithms+books&otracker=search&otracker1=search&marketplace=FLIPKART&as-show=on&as=off&page=1,data structure and algorithms
Data Structures Using C With Complete Algorithms,"Paperback, rajni jindal",https://rukminim1.flixcart.com/image/612/612/kc29n680/regionalbooks/x/3/q/data-structures-using-c-with-complete-algorithms-original-imaft9xhdn5qurwg.jpeg?q=70,₹200,4.8,(4),https://www.flipkart.com/search?q=data+structure+and+algorithms+books&otracker=search&otracker1=search&marketplace=FLIPKART&as-show=on&as=off&page=1,data structure and algorithms
Data Structures and Algorithms,"English, Paperback, S.Vijay,Dr. G. Kesavaraj,V. Janarthanan,",https://rukminim1.flixcart.com/image/612/612/k7nnrm80/book/1/3/1/data-structures-and-algorithms-original-imafpusghub4hwvv.jpeg?q=70,₹180,4.2,(19),https://www.flipkart.com/search?q=data+structure+and+algorithms+books&otracker=search&otracker1=search&marketplace=FLIPKART&as-show=on&as=off&page=1,data structure and algorithms
Data Structures and Algorithms in Python,"English, Paperback, Goodrich M. T.",https://rukminim1.flixcart.com/image/612/612/krkyt8w0/book/r/e/j/data-structures-and-algorithms-in-python-an-indian-adaptation-original-imag5c99saagk6ye.jpeg?q=70,₹745,4.9,(29),https://www.flipkart.com/search?q=data+structure+and+algorithms+books&otracker=search&otracker1=search&marketplace=FLIPKART&as-show=on&as=off&page=1,data structure and algorithms
Data Structures & Algorithms in Kotlin,"English, Paperback, Jain Hemant",https://rukminim1.flixcart.com/image/612/612/kmwcuq80/book/j/v/4/data-structures-algorithms-in-kotlin-original-imagfzg6ephfsyjg.jpeg?q=70,₹550,,,https://www.flipkart.com/search?q=data+structure+and+algorithms+books&otracker=search&otracker1=search&marketplace=FLIPKART&as-show=on&as=off&page=1,data structure and algorithms
Data Structure and Algorithm,"English, Paperback, Mr. Rajesh Yemul, Mr. Vijay T. Patil",https://rukminim1.flixcart.com/image/612/612/k6v2ykw0/book/8/4/2/data-structure-and-algorithm-original-imafp7k7njkhrhcs.jpeg?q=70,₹290,3.7,(3),https://www.flipkart.com/search?q=data+structure+and+algorithms+books&otracker=search&otracker1=search&marketplace=FLIPKART&as-show=on&as=off&page=1,data structure and algorithms
C++ Data Structures and Algorithm Design Principles,"English, Paperback, Carey John",https://rukminim1.flixcart.com/image/612/612/xif0q/book/k/1/8/c-data-structures-and-algorithm-design-principles-original-imagmfefkfvfvn8z.jpeg?q=70,"₹1,848",,,https://www.flipkart.com/search?q=data+structure+and+algorithms+books&otracker=search&otracker1=search&marketplace=FLIPKART&as-show=on&as=off&page=1,data structure and algorithms
